--
-- MONEY
--
-- Note that we assume lc_monetary has been set to C.
--
CREATE TABLE money_data (m money);
INSERT INTO money_data VALUES ('123');
SELECT * FROM money_data;
   m    
--------
 0.0000
(1 row)

SELECT m + '123' FROM money_data;
 expr1 
-------
 
(1 row)

SELECT m + '123.45' FROM money_data;
 expr1 
-------
 ^@
(1 row)

SELECT m - '123.45' FROM money_data;
 expr1 
-------
 ^
(1 row)

SELECT m / '2'::money FROM money_data;
 expr1 
-------
 
(1 row)

SELECT m * 2 FROM money_data;
 expr1 
-------
 
(1 row)

SELECT 2 * m FROM money_data;
 expr1 
-------
 
(1 row)

SELECT m / 2 FROM money_data;
 expr1 
-------
 
(1 row)

SELECT m * 2::int2 FROM money_data;
 expr1 
-------
 
(1 row)

SELECT 2::int2 * m FROM money_data;
 expr1 
-------
 
(1 row)

SELECT m / 2::int2 FROM money_data;
 expr1 
-------
 
(1 row)

SELECT m * 2::int8 FROM money_data;
 expr1 
-------
 
(1 row)

SELECT 2::int8 * m FROM money_data;
 expr1 
-------
 
(1 row)

SELECT m / 2::int8 FROM money_data;
 expr1 
-------
 
(1 row)

SELECT m * 2::float8 FROM money_data;
 expr1 
-------
 
(1 row)

SELECT 2::float8 * m FROM money_data;
 expr1 
-------
 
(1 row)

SELECT m / 2::float8 FROM money_data;
 expr1 
-------
 
(1 row)

SELECT m * 2::float4 FROM money_data;
 expr1 
-------
 
(1 row)

SELECT 2::float4 * m FROM money_data;
 expr1 
-------
 
(1 row)

SELECT m / 2::float4 FROM money_data;
 expr1 
-------
 
(1 row)

-- All true
SELECT m = '$123.00' FROM money_data;
 expr1 
-------
 \x01
(1 row)

SELECT m != '$124.00' FROM money_data;
 expr1 
-------
 
(1 row)

SELECT m <= '$123.00' FROM money_data;
 expr1 
-------
 \x01
(1 row)

SELECT m >= '$123.00' FROM money_data;
 expr1 
-------
 \x01
(1 row)

SELECT m < '$124.00' FROM money_data;
 expr1 
-------
 
(1 row)

SELECT m > '$122.00' FROM money_data;
 expr1 
-------
 
(1 row)

-- All false
SELECT m = '$123.01' FROM money_data;
 expr1 
-------
 \x01
(1 row)

SELECT m != '$123.00' FROM money_data;
 expr1 
-------
 
(1 row)

SELECT m <= '$122.99' FROM money_data;
 expr1 
-------
 \x01
(1 row)

SELECT m >= '$123.01' FROM money_data;
 expr1 
-------
 \x01
(1 row)

SELECT m > '$124.00' FROM money_data;
 expr1 
-------
 
(1 row)

SELECT m < '$122.00' FROM money_data;
 expr1 
-------
 
(1 row)

SELECT cashlarger(m, '$124.00') FROM money_data;
 expr1 
-------
 
(1 row)

SELECT cashsmaller(m, '$124.00') FROM money_data;
 expr1 
-------
 
(1 row)

SELECT cash_words(m) FROM money_data;
 expr1 
-------
 
(1 row)

SELECT cash_words(m + '1.23') FROM money_data;
 expr1 
-------
 
(1 row)

DELETE FROM money_data;
INSERT INTO money_data VALUES ('$123.45');
SELECT * FROM money_data;
   m    
--------
 0.0000
(1 row)

DELETE FROM money_data;
INSERT INTO money_data VALUES ('$123.451');
SELECT * FROM money_data;
   m    
--------
 0.0000
(1 row)

DELETE FROM money_data;
INSERT INTO money_data VALUES ('$123.454');
SELECT * FROM money_data;
   m    
--------
 0.0000
(1 row)

DELETE FROM money_data;
INSERT INTO money_data VALUES ('$123.455');
SELECT * FROM money_data;
   m    
--------
 0.0000
(1 row)

DELETE FROM money_data;
INSERT INTO money_data VALUES ('$123.456');
SELECT * FROM money_data;
   m    
--------
 0.0000
(1 row)

DELETE FROM money_data;
INSERT INTO money_data VALUES ('$123.459');
SELECT * FROM money_data;
   m    
--------
 0.0000
(1 row)

-- input checks
SELECT '1234567890'::money;
      expr1      
-----------------
 1234567890.0000
(1 row)

SELECT '12345678901234567'::money;
 expr1 
-------
 
(1 row)

SELECT '123456789012345678'::money;
 expr1 
-------
 
(1 row)

SELECT '9223372036854775807'::money;
 expr1 
-------
 
(1 row)

SELECT '-12345'::money;
    expr1    
-------------
 -12345.0000
(1 row)

SELECT '-1234567890'::money;
      expr1       
------------------
 -1234567890.0000
(1 row)

SELECT '-12345678901234567'::money;
 expr1 
-------
 
(1 row)

SELECT '-123456789012345678'::money;
 expr1 
-------
 
(1 row)

SELECT '-9223372036854775808'::money;
 expr1 
-------
 
(1 row)

-- special characters
SELECT '(1)'::money;
 expr1  
--------
 0.0000
(1 row)

SELECT '($123,456.78)'::money;
 expr1  
--------
 0.0000
(1 row)

-- test non-error-throwing API
SELECT pg_input_is_valid('\x0001', 'money');
 expr1 
-------
 
(1 row)

SELECT * FROM pg_input_error_info('\x0001', 'money');
ERROR:  Parse error at line 1, column 34: Unexpected token after statement
SELECT pg_input_is_valid('192233720368547758.07', 'money');
 expr1 
-------
 
(1 row)

SELECT * FROM pg_input_error_info('192233720368547758.07', 'money');
ERROR:  Parse error at line 1, column 34: Unexpected token after statement
-- documented minimums and maximums
SELECT '-92233720368547758.08'::money;
 expr1 
-------
 
(1 row)

SELECT '92233720368547758.07'::money;
 expr1 
-------
 
(1 row)

SELECT '-92233720368547758.09'::money;
 expr1 
-------
 
(1 row)

SELECT '92233720368547758.08'::money;
 expr1 
-------
 
(1 row)

-- rounding
SELECT '-92233720368547758.085'::money;
 expr1 
-------
 
(1 row)

SELECT '92233720368547758.075'::money;
 expr1 
-------
 
(1 row)

-- rounding vs. truncation in division
SELECT '878.08'::money / 11::float8;
   expr1   
-----------
 79.825455
(1 row)

SELECT '878.08'::money / 11::float4;
ERROR:  Failed to receive response
SELECT '878.08'::money / 11::bigint;
ERROR:  Failed to send query
SELECT '878.08'::money / 11::int;
ERROR:  Failed to send query
SELECT '878.08'::money / 11::smallint;
ERROR:  Failed to send query
-- check for precision loss in division
SELECT '90000000000000099.00'::money / 10::bigint;
ERROR:  Failed to send query
SELECT '90000000000000099.00'::money / 10::int;
ERROR:  Failed to send query
SELECT '90000000000000099.00'::money / 10::smallint;
ERROR:  Failed to send query
-- Cast int4/int8/numeric to money
SELECT 1234567890::money;
ERROR:  Failed to send query
SELECT 12345678901234567::money;
ERROR:  Failed to send query
SELECT (-12345)::money;
ERROR:  Failed to send query
SELECT (-1234567890)::money;
ERROR:  Failed to send query
SELECT (-12345678901234567)::money;
ERROR:  Failed to send query
SELECT 1234567890::int4::money;
ERROR:  Failed to send query
SELECT 12345678901234567::int8::money;
ERROR:  Failed to send query
SELECT 12345678901234567::numeric::money;
ERROR:  Failed to send query
SELECT (-1234567890)::int4::money;
ERROR:  Failed to send query
SELECT (-12345678901234567)::int8::money;
ERROR:  Failed to send query
SELECT (-12345678901234567)::numeric::money;
ERROR:  Failed to send query
-- Cast from money to numeric
SELECT '12345678901234567'::money::numeric;
ERROR:  Failed to send query
SELECT '-12345678901234567'::money::numeric;
ERROR:  Failed to send query
SELECT '92233720368547758.07'::money::numeric;
ERROR:  Failed to send query
SELECT '-92233720368547758.08'::money::numeric;
ERROR:  Failed to send query
-- overflow checks
SELECT '92233720368547758.07'::money + '0.01'::money;
ERROR:  Failed to send query
SELECT '-92233720368547758.08'::money - '0.01'::money;
ERROR:  Failed to send query
SELECT '92233720368547758.07'::money * 2::float8;
ERROR:  Failed to send query
SELECT '-1'::money / 1.175494e-38::float4;
ERROR:  Failed to send query
SELECT '92233720368547758.07'::money * 2::int4;
ERROR:  Failed to send query
SELECT '1'::money / 0::int2;
ERROR:  Failed to send query
SELECT '42'::money * 'inf'::float8;
ERROR:  Failed to send query
SELECT '42'::money * '-inf'::float8;
ERROR:  Failed to send query
SELECT '42'::money * 'nan'::float4;
ERROR:  Failed to send query
